{
  "spec_format_version": 2,
  "spec_id": "dacapo-heaan-cpu-v1",
  "version": 1,
  "status": "imported",
  "target_id": "dacapo-heaan-cpu",
  "rescale_mode": "eager",
  "noise_unit": null,
  "provenance": {
    "kind": "dacapo-profile-json",
    "repository": "git@github.com:mingerfan/dacapo-modified.git",
    "revision": "a2c9ce41a57062cdf77ea4bac5b02be747109448",
    "path": "profiled_HEAAN_CPU.json",
    "source_sha256": "sha256:b8d56556eb3ca8defd61b72c25515f6b264371baaed8af068137050c63acd100"
  },
  "context": {
    "context_id": "dacapo-heaan-fva",
    "poly_degree": 131072,
    "rns_moduli_log2": [
      51,
      51,
      51,
      51,
      51,
      51,
      51,
      51,
      51,
      51,
      51,
      51,
      51,
      51,
      51,
      51,
      51,
      51,
      51,
      51,
      51,
      51,
      51,
      51,
      51,
      51,
      51,
      51,
      51,
      51
    ],
    "max_modulus_log2": 51,
    "default_scale_log2": 40
  },
  "levels": {
    "lower_bound": 1,
    "upper_bound": 29
  },
  "operators": {
    "add_cc": {
      "supported": true,
      "latency_us_by_level": [
        0,
        0,
        259,
        330,
        408,
        615,
        783,
        972,
        1095,
        1223,
        1350,
        1641,
        1693,
        1939,
        2102,
        2227,
        2939,
        2922,
        3560,
        3823,
        3656,
        3958,
        4321,
        4524,
        4592,
        4815,
        4960,
        5243,
        5374,
        5571
      ],
      "noise_by_level": null
    },
    "add_cp": {
      "supported": true,
      "latency_us_by_level": [
        0,
        0,
        201,
        225,
        313,
        455,
        543,
        714,
        838,
        959,
        1109,
        1294,
        1429,
        1535,
        1764,
        1787,
        2417,
        2571,
        2382,
        3013,
        3038,
        2915,
        3976,
        3229,
        3820,
        3698,
        3833,
        4036,
        3955,
        4180
      ],
      "noise_by_level": null
    },
    "sub_cc": {
      "supported": false,
      "latency_us_by_level": null,
      "noise_by_level": null
    },
    "sub_cp": {
      "supported": false,
      "latency_us_by_level": null,
      "noise_by_level": null
    },
    "mul_cc": {
      "supported": true,
      "latency_us_by_level": [
        0,
        0,
        27947,
        32333,
        33450,
        38230,
        37359,
        40282,
        47666,
        39999,
        50739,
        57638,
        60631,
        66196,
        66020,
        73180,
        74333,
        78675,
        76957,
        77676,
        83810,
        96482,
        105008,
        104891,
        108879,
        114420,
        113682,
        118998,
        121591,
        126785
      ],
      "noise_by_level": null
    },
    "mul_cp": {
      "supported": true,
      "latency_us_by_level": [
        0,
        0,
        385,
        909,
        524,
        350,
        513,
        688,
        797,
        1164,
        1319,
        1473,
        2106,
        2369,
        2291,
        2912,
        3605,
        2942,
        3258,
        3395,
        4013,
        3860,
        3976,
        4153,
        4471,
        4558,
        4785,
        5044,
        5226,
        5417
      ],
      "noise_by_level": null
    },
    "negate": {
      "supported": true,
      "latency_us_by_level": [
        0,
        0,
        215,
        149,
        190,
        277,
        416,
        353,
        514,
        736,
        881,
        1019,
        1166,
        1372,
        1390,
        1560,
        1739,
        1957,
        2087,
        2199,
        2356,
        2754,
        2818,
        2834,
        3169,
        3286,
        3791,
        3901,
        3932,
        3951
      ],
      "noise_by_level": null
    },
    "rotate": {
      "supported": true,
      "latency_us_by_level": [
        0,
        0,
        27949,
        31028,
        34648,
        35064,
        33829,
        37232,
        35189,
        38283,
        40788,
        51979,
        59247,
        55781,
        62503,
        61885,
        63596,
        64651,
        69415,
        68642,
        71569,
        84616,
        88641,
        91828,
        95572,
        96443,
        101651,
        104770,
        109234,
        112545
      ],
      "noise_by_level": null
    },
    "rescale": {
      "supported": true,
      "latency_us_by_level": [
        0,
        0,
        9131,
        9382,
        10277,
        10068,
        10352,
        10381,
        11466,
        11500,
        11616,
        12957,
        16682,
        18297,
        19779,
        24229,
        25911,
        35433,
        30668,
        28342,
        38024,
        33515,
        27870,
        34367,
        34146,
        31918,
        32935,
        32822,
        32529,
        37545
      ],
      "noise_by_level": null,
      "max_levels_per_op": 1
    },
    "mod_switch": {
      "supported": true,
      "latency_us_by_level": [
        0,
        0,
        9077,
        9053,
        10995,
        10429,
        10132,
        11014,
        10295,
        11202,
        11424,
        12495,
        14827,
        18663,
        18713,
        27297,
        26041,
        23080,
        27980,
        29354,
        28937,
        30511,
        27412,
        31269,
        33308,
        26573,
        36537,
        32161,
        30437,
        33541
      ],
      "noise_by_level": null
    },
    "relinearize": {
      "supported": false,
      "latency_us_by_level": null,
      "noise_by_level": null
    },
    "boot": {
      "supported": true
    }
  },
  "boot_profiles": [
    {
      "profile_id": "dacapo-heaan-cpu-boot-v1",
      "implementation": "native",
      "input_level_min": 3,
      "input_level_max": 16,
      "input_components": 2,
      "output_level": 16,
      "output_scale_log2": 40,
      "output_components": 2,
      "latency_us_by_input_level": [
        0,
        0,
        0,
        0,
        0,
        14135510,
        14077301,
        14212629,
        14170328,
        14268996,
        14273886,
        14242626,
        14170021,
        14140397,
        14313566,
        14182921,
        14260240,
        14187921,
        14187921,
        14187921,
        14187921,
        14187921,
        14187921,
        14187921,
        14187921,
        14187921,
        14187921,
        14187921,
        14187921,
        14187921
      ],
      "noise_by_input_level": null,
      "host_requirements": {
        "needs_secret_key": false,
        "needs_host_compute": false
      }
    }
  ]
}
